{
  "$schema": "https://json-schema.org/draft/2020-12/schema",
  "$id": "urn:paper-stm-repair:r3:conversion-report:v0",
  "title": "R3 selected examples conversion report v0",
  "type": "object",
  "required": [
    "report_version",
    "run_id",
    "items",
    "loss_ledger_sha256",
    "note"
  ],
  "properties": {
    "report_version": {
      "const": "r3.selected_seed_examples_conversion_report.v0"
    },
    "run_id": {
      "type": "string"
    },
    "loss_ledger_sha256": {
      "type": "string",
      "pattern": "^[0-9a-f]{64}$"
    },
    "note": {
      "type": "string"
    },
    "items": {
      "type": "array",
      "minItems": 1,
      "items": {
        "$ref": "#/$defs/item"
      }
    }
  },
  "additionalProperties": false,
  "$defs": {
    "item": {
      "type": "object",
      "required": [
        "example_id",
        "seed_id",
        "source_format",
        "adapter",
        "status",
        "status_reason_code",
        "states_count",
        "transitions_count",
        "variables_count",
        "resolved_states_count",
        "resolved_transitions_count",
        "timing_level",
        "hierarchy_level",
        "losses_count",
        "blocking_reason",
        "source_sha256",
        "canonical_output_sha256",
        "canonical_output_path",
        "source_nl_path",
        "source_stm0_path",
        "report_version",
        "run_id",
        "created_at",
        "conversion_command",
        "repo_commit",
        "input_version",
        "schema_version",
        "adapter_version",
        "tool_name",
        "tool_version",
        "tool_source_url",
        "tool_invocation_status",
        "tool_preflight",
        "source_locator",
        "raw_locator",
        "source_meta_path",
        "loss_ledger_path",
        "report_sha256",
        "conversion_source",
        "canonical_extraction_method",
        "structured_export_path",
        "fallback_used",
        "fallback_scope",
        "manual_normalization",
        "manual_edit_allowed",
        "manual_edit_ledger_ref",
        "eligibility",
        "diagnostics"
      ],
      "properties": {
        "example_id": {
          "type": "string"
        },
        "seed_id": {
          "type": "string"
        },
        "source_format": {
          "enum": [
            "plantuml",
            "umple",
            "ttool_xml"
          ]
        },
        "adapter": {
          "enum": [
            "plantuml",
            "umple",
            "ttool_xml"
          ]
        },
        "status": {
          "enum": [
            "converted",
            "partial",
            "blocked",
            "unsupported"
          ]
        },
        "status_reason_code": {
          "enum": [
            "R3.STATUS.converted",
            "R3.STATUS.partial",
            "R3.STATUS.blocked",
            "R3.STATUS.unsupported"
          ]
        },
        "states_count": {
          "type": "integer",
          "minimum": 0
        },
        "transitions_count": {
          "type": "integer",
          "minimum": 0
        },
        "variables_count": {
          "type": "integer",
          "minimum": 0
        },
        "resolved_states_count": {
          "type": "integer",
          "minimum": 0
        },
        "resolved_transitions_count": {
          "type": "integer",
          "minimum": 0
        },
        "timing_level": {
          "enum": [
            "none",
            "qualitative",
            "clock",
            "timed_constraints",
            "unknown"
          ]
        },
        "hierarchy_level": {
          "enum": [
            "flat",
            "hierarchical",
            "concurrent",
            "unknown"
          ]
        },
        "losses_count": {
          "type": "integer",
          "minimum": 0
        },
        "blocking_reason": {
          "type": [
            "string",
            "null"
          ]
        },
        "source_sha256": {
          "type": "string",
          "pattern": "^[0-9a-f]{64}$"
        },
        "canonical_output_sha256": {
          "type": [
            "string",
            "null"
          ],
          "pattern": "^[0-9a-f]{64}$"
        },
        "canonical_output_path": {
          "type": [
            "string",
            "null"
          ],
          "minLength": 1
        },
        "report_version": {
          "const": "r3.conversion_report.v0"
        },
        "run_id": {
          "type": "string"
        },
        "created_at": {
          "type": "string"
        },
        "conversion_command": {
          "type": "string"
        },
        "repo_commit": {
          "type": "string"
        },
        "input_version": {
          "type": "string",
          "pattern": "^[0-9a-f]{64}$"
        },
        "schema_version": {
          "const": "r3.canonical_stm.v0"
        },
        "adapter_version": {
          "type": "string"
        },
        "tool_name": {
          "type": [
            "string",
            "null"
          ]
        },
        "tool_version": {
          "type": [
            "string",
            "null"
          ]
        },
        "tool_source_url": {
          "type": [
            "string",
            "null"
          ]
        },
        "tool_invocation_status": {
          "type": [
            "string",
            "null"
          ]
        },
        "tool_preflight": {
          "type": [
            "object",
            "null"
          ],
          "required": [
            "tool_name",
            "tool_version",
            "tool_source_url",
            "tool_invocation_status",
            "syntax_status",
            "structured_export_status",
            "structured_export_format",
            "structured_export_sha256",
            "structured_export_path",
            "command",
            "returncode",
            "stdout_tail",
            "stderr_tail",
            "fallback_reason",
            "evidence"
          ],
          "properties": {
            "tool_name": {
              "type": "string"
            },
            "tool_version": {
              "type": [
                "string",
                "null"
              ]
            },
            "tool_source_url": {
              "type": "string"
            },
            "tool_invocation_status": {
              "type": "string"
            },
            "syntax_status": {
              "type": "string"
            },
            "structured_export_status": {
              "type": "string"
            },
            "structured_export_format": {
              "type": [
                "string",
                "null"
              ]
            },
            "structured_export_sha256": {
              "type": [
                "string",
                "null"
              ],
              "pattern": "^[0-9a-f]{64}$"
            },
            "structured_export_path": {
              "type": [
                "string",
                "null"
              ]
            },
            "command": {
              "type": [
                "array",
                "null"
              ],
              "items": {
                "type": "string"
              }
            },
            "returncode": {
              "type": [
                "integer",
                "null"
              ]
            },
            "stdout_tail": {
              "type": [
                "string",
                "null"
              ]
            },
            "stderr_tail": {
              "type": [
                "string",
                "null"
              ]
            },
            "fallback_reason": {
              "type": [
                "string",
                "null"
              ]
            },
            "evidence": {
              "type": "object"
            }
          },
          "additionalProperties": false
        },
        "source_locator": {
          "type": "string"
        },
        "raw_locator": {
          "type": [
            "string",
            "null"
          ]
        },
        "source_meta_path": {
          "type": "string"
        },
        "loss_ledger_path": {
          "type": "string"
        },
        "report_sha256": {
          "type": [
            "string",
            "null"
          ],
          "pattern": "^[0-9a-f]{64}$"
        },
        "manual_normalization": {
          "type": "boolean"
        },
        "manual_edit_allowed": {
          "const": false
        },
        "manual_edit_ledger_ref": {
          "type": [
            "string",
            "null"
          ]
        },
        "eligibility": {
          "type": "string"
        },
        "diagnostics": {
          "type": "array",
          "items": {
            "type": "object"
          }
        },
        "conversion_source": {
          "type": [
            "string",
            "null"
          ],
          "enum": [
            "official_scxml",
            "official_xml",
            "no_canonical_conversion",
            null
          ]
        },
        "canonical_extraction_method": {
          "type": [
            "string",
            "null"
          ]
        },
        "structured_export_path": {
          "type": [
            "string",
            "null"
          ]
        },
        "fallback_used": {
          "type": "boolean"
        },
        "fallback_scope": {
          "type": [
            "string",
            "null"
          ]
        },
        "source_nl_path": {
          "type": "string",
          "minLength": 1
        },
        "source_stm0_path": {
          "type": "string",
          "minLength": 1
        }
      },
      "additionalProperties": false
    }
  }
}
