{
  "items": [
    {
      "adapter": "plantuml",
      "adapter_version": "0.1.0",
      "blocking_reason": null,
      "canonical_extraction_method": "PlantUML -tscxml export parsed by xml.etree.ElementTree",
      "canonical_output_path": "project_1_llm_state_machine_modeling/paper_stm_repair/pipeline/conversion/reports/canonical/llms-emp-deepseek-microwave.canonical_stm.json",
      "canonical_output_sha256": "4a5b843abb436082aeb2804de8041b51f4a1a7d88104cf315e9421ae1800f9c0",
      "conversion_command": "python -m paper_stm_repair_conversion.cli convert-selected",
      "conversion_source": "official_scxml",
      "created_at": "2026-06-27T11:25:39.524854+00:00",
      "diagnostics": [
        {
          "code": "R3.STRUCTURED_EXPORT.CANONICAL_FROM_SCXML",
          "message": "Canonical states/transitions were extracted from official SCXML structured export, not from source-text parsing.",
          "severity": "info",
          "structured_export_path": "project_1_llm_state_machine_modeling/paper_stm_repair/pipeline/conversion/reports/toolchain_exports/llms-emp-deepseek-microwave/stm0.r3_1_normalized.scxml"
        },
        {
          "code": "R3.R31.NORMALIZED_SCXML_REPLAY_USED",
          "message": "Raw selected PlantUML failed official SCXML export, so R3 replayed a committed R3.1 deterministic normalized candidate and re-ran official PlantUML -tscxml. This is conversion normalization only, not repair gain.",
          "normalized_structured_export_path": "project_1_llm_state_machine_modeling/paper_stm_repair/pipeline/conversion/reports/toolchain_exports/llms-emp-deepseek-microwave/stm0.r3_1_normalized.scxml",
          "raw_structured_export_status": "scxml_not_trusted_after_syntax_failure",
          "raw_syntax_status": "failed",
          "recovery_report_path": "project_1_llm_state_machine_modeling/paper_stm_repair/pipeline/conversion/reports/plantuml_recovery_report.json",
          "severity": "info"
        },
        {
          "code": "R3.TOOLCHAIN.OFFICIAL_SYNTAX_OK",
          "message": "Official/mature toolchain syntax preflight succeeded before R3 canonical structured extraction.",
          "severity": "info",
          "structured_export_path": "project_1_llm_state_machine_modeling/paper_stm_repair/pipeline/conversion/reports/toolchain_exports/llms-emp-deepseek-microwave/stm0.r3_1_normalized.scxml",
          "structured_export_status": "scxml_export_ok",
          "tool_name": "PlantUML CLI"
        }
      ],
      "eligibility": "r3_smoke_fixture_only_not_main_experiment",
      "example_id": "llms-emp-deepseek-microwave",
      "fallback_scope": null,
      "fallback_used": false,
      "hierarchy_level": "hierarchical",
      "input_version": "3978af489c925855e8a6b56494334a22dbe8f88dda0a67e8a6f27142949c2262",
      "loss_ledger_path": "project_1_llm_state_machine_modeling/paper_stm_repair/pipeline/conversion/reports/selected_seed_examples_loss_ledger.jsonl",
      "losses_count": 0,
      "manual_edit_allowed": false,
      "manual_edit_ledger_ref": null,
      "manual_normalization": false,
      "raw_locator": "sheet=STM Results; row=45; columns=Requirement Description,Generation PlantUML,LLMs,Model Source,Model Name,PlantUML",
      "repo_commit": "e66c398fa7435c22557723a3c78f88e32446ac45",
      "report_sha256": "113ab3d904073ac7696f1ee1baedf4adec2ad2e9688a8fb4ff0decad99f74732",
      "report_version": "r3.conversion_report.v0",
      "resolved_states_count": 17,
      "resolved_transitions_count": 20,
      "run_id": "r3-selected-seed-examples-v0",
      "schema_version": "r3.canonical_stm.v0",
      "seed_id": "llms-emp-stm-subset",
      "source_format": "plantuml",
      "source_locator": "pipeline/conversion/fixtures/r3_selected_seed_examples/llms-emp-deepseek-microwave/stm0.puml",
      "source_meta_path": "project_1_llm_state_machine_modeling/paper_stm_repair/pipeline/conversion/fixtures/r3_selected_seed_examples/llms-emp-deepseek-microwave/source_meta.json",
      "source_nl_path": "project_1_llm_state_machine_modeling/paper_stm_repair/pipeline/conversion/fixtures/r3_selected_seed_examples/llms-emp-deepseek-microwave/nl.txt",
      "source_sha256": "bfe9731bf60d0dc17fd31b89dec3826f9c29be2eeebb752b48b5a1289440425e",
      "source_stm0_path": "project_1_llm_state_machine_modeling/paper_stm_repair/pipeline/conversion/fixtures/r3_selected_seed_examples/llms-emp-deepseek-microwave/stm0.puml",
      "states_count": 17,
      "status": "converted",
      "status_reason_code": "R3.STATUS.converted",
      "structured_export_path": "project_1_llm_state_machine_modeling/paper_stm_repair/pipeline/conversion/reports/toolchain_exports/llms-emp-deepseek-microwave/stm0.r3_1_normalized.scxml",
      "timing_level": "none",
      "tool_invocation_status": "official_cli_syntax_and_scxml_ok_after_r3_1_normalization_replay",
      "tool_name": "PlantUML CLI",
      "tool_preflight": {
        "command": [
          "java",
          "-jar",
          "external-local-tool/plantuml.jar",
          "-checkonly",
          "external-run-artifact/0045__llms-emp-stm-subset__llms_emp_stm_results_0045__normalized.puml"
        ],
        "evidence": {
          "committed_export_reuse_allowed": false,
          "download_hint": "https://github.com/plantuml/plantuml/releases ; https://plantuml.com/download",
          "java_version": "java version \"1.8.0_202\"\nJava(TM) SE Runtime Environment (build 1.8.0_202-b08)\nJava HotSpot(TM) 64-Bit Server VM (build 25.202-b08, mixed mode)",
          "no_text_fallback_policy": "R3 不允许在官方工具链缺失、不可执行、syntax check 失败或结构化导出失败时，静默退回 regex/string/source-text parser，也不允许复用已提交 SCXML fixture 冒充本次转换证据。",
          "official_capability": "headless syntax check/render; state diagram SCXML; XMI is for class diagrams; no documented AST export",
          "r3_1_normalization_replay": true,
          "r3_1_normalized_candidate_member": "normalized_candidates/0045__llms-emp-stm-subset__llms_emp_stm_results_0045__normalized.puml",
          "r3_1_original_raw_preflight": {
            "fallback_reason": "Official PlantUML syntax check failed; R3 does not use any source-text parser as canonical conversion source. The example cannot be marked converted. R3 不允许在官方工具链缺失、不可执行、syntax check 失败或结构化导出失败时，静默退回 regex/string/source-text parser，也不允许复用已提交 SCXML fixture 冒充本次转换证据。",
            "structured_export_status": "scxml_not_trusted_after_syntax_failure",
            "syntax_status": "failed"
          },
          "r3_1_recovery_archive_path": "project_1_llm_state_machine_modeling/paper_stm_repair/pipeline/conversion/artifacts/plantuml_recovery/r3_1_committed/workdir.zip",
          "r3_1_recovery_report_path": "project_1_llm_state_machine_modeling/paper_stm_repair/pipeline/conversion/reports/plantuml_recovery_report.json",
          "raw_candidate_path": "normalized_candidates/0045__llms-emp-stm-subset__llms_emp_stm_results_0045__raw.puml",
          "rule_ids": [
            "PUML.NORM.remove_stm_heading"
          ],
          "scxml_command": [
            "java",
            "-jar",
            "external-local-tool/plantuml.jar",
            "-tscxml",
            "external-run-artifact/0045__llms-emp-stm-subset__llms_emp_stm_results_0045__normalized.puml"
          ],
          "scxml_returncode": 0,
          "selected_tool": "external-local-tool/plantuml.jar",
          "semantic_preservation_pass": true,
          "setup_hint": "PlantUML 配置建议：\n1. 下载官方 plantuml.jar： https://github.com/plantuml/plantuml/releases 或 https://plantuml.com/download\n2. 设置环境变量： `export PLANTUML_JAR=/abs/path/to/plantuml.jar`；或放到仓库 `tools/plantuml.jar`。\n3. 也可安装 PATH 中可执行的 `plantuml` 命令。\n4. 复验命令： `java -jar $PLANTUML_JAR -version`、`java -jar $PLANTUML_JAR -checkonly selected_seed_examples/<id>/stm0.puml`、`java -jar $PLANTUML_JAR -tscxml selected_seed_examples/<id>/stm0.puml`。\n当前仓库候选显式路径：tools/plantuml.jar",
          "source_line_sha256": "94c10d1df95605e4c9c03c92e0363ef59fb41d1640d6503a0432474738d2656e"
        },
        "fallback_reason": null,
        "returncode": 0,
        "stderr_tail": "",
        "stdout_tail": "",
        "structured_export_format": "scxml",
        "structured_export_path": "project_1_llm_state_machine_modeling/paper_stm_repair/pipeline/conversion/reports/toolchain_exports/llms-emp-deepseek-microwave/stm0.r3_1_normalized.scxml",
        "structured_export_sha256": "8aa1f7fe652d9a4a4680fce49762cb47ffaae6467e34f00cd17bfd3187212b20",
        "structured_export_status": "scxml_export_ok",
        "syntax_status": "ok",
        "tool_invocation_status": "official_cli_syntax_and_scxml_ok_after_r3_1_normalization_replay",
        "tool_name": "PlantUML CLI",
        "tool_source_url": "https://plantuml.com/command-line",
        "tool_version": "PlantUML version 1.2024.7 (Sat Sep 07 19:18:17 CST 2024)\n(GPL source distribution)\nJava Runtime: Java(TM) SE Runtime Environment\nJVM: Java HotSpot(TM) 64-Bit Server VM\nDefault Encoding: UTF-8\nLanguage: en\nCountry: null\n \nPLANTUML_LIMIT_SIZE: 4096\n\nDot version: dot - graphviz version 2.43.0 (0)\nInstallation seems OK. File generation OK"
      },
      "tool_source_url": "https://plantuml.com/command-line",
      "tool_version": "PlantUML version 1.2024.7 (Sat Sep 07 19:18:17 CST 2024)\n(GPL source distribution)\nJava Runtime: Java(TM) SE Runtime Environment\nJVM: Java HotSpot(TM) 64-Bit Server VM\nDefault Encoding: UTF-8\nLanguage: en\nCountry: null\n \nPLANTUML_LIMIT_SIZE: 4096\n\nDot version: dot - graphviz version 2.43.0 (0)\nInstallation seems OK. File generation OK",
      "transitions_count": 20,
      "variables_count": 0
    },
    {
      "adapter": "plantuml",
      "adapter_version": "0.1.0",
      "blocking_reason": null,
      "canonical_extraction_method": "PlantUML -tscxml export parsed by xml.etree.ElementTree",
      "canonical_output_path": "project_1_llm_state_machine_modeling/paper_stm_repair/pipeline/conversion/reports/canonical/llms-emp-gpt4o-hldcs.canonical_stm.json",